{
  "id": "knowledge_day",
  "title": "День знаний",
  "aliases": [
    "1 сентября",
    "День знаний"
  ],
  "category": "federal",
  "date_rule": {
    "type": "fixed",
    "value": "09-01",
    "note": "Ежегодно, 1 сентября"
  },
  "supported_age_groups": [
    "1-4",
    "5-8",
    "9-11"
  ],
  "supported_formats": [
    "class_hour",
    "school_event",
    "interactive_lesson"
  ],
  "educational_goals": [
    "Мотивация к учебному году",
    "Формирование чувства принадлежности к школьному сообществу",
    "Постановка учебных целей"
  ],
  "values": [
    "mutual_aid",
    "citizenship"
  ],
  "age_appropriateness_notes": {
    "1-4": "Игровые механики, знакомство с правилами и друг с другом, короткие активности. Доброжелательный формат; избегать проверок знаний и сравнения успеваемости детей.",
    "5-8": "Командные задания, цели и роли в классе на год, правила безопасного общения. Не перегружать административными речами.",
    "9-11": "Дискуссия о личных учебных целях, самостоятельности и планировании, наставничество младшим. Уважать разные образовательные траектории."
  },
  "facts_to_verify": [
    "Правовое/официальное основание даты 1 сентября и актуальные рекомендации Минпросвещения на нужный год",
    "Официальные рекомендации для школ Свердловской области на конкретный учебный год",
    "Региональные школьные традиции: отделять официально подтверждённые практики от примеров отдельных школ"
  ],
  "regional_topics": [],
  "source_collection": "knowledge_day",
  "source_ids": [
    "src_knowledge_day_audit_01",
    "src_knowledge_day_audit_02",
    "src_knowledge_day_audit_03",
    "src_knowledge_day_v19_01",
    "src_knowledge_day_v19_03",
    "src_knowledge_day_004"
  ],
  "review": {
    "historical_accuracy_required": false,
    "age_appropriateness_required": true,
    "cultural_review_required": true
  },
  "regional_variants": [
    "RU-SVE"
  ],
  "catalog_version": "2.6",
  "updated_at": "2026-10-26"
}