{
  "id": "christmas",
  "title": "Рождество Христово",
  "aliases": [
    "7 января",
    "Рождество"
  ],
  "category": "cultural",
  "date_rule": {
    "type": "fixed",
    "value": "01-07",
    "note": "Ежегодно, 7 января"
  },
  "supported_age_groups": [
    "1-4",
    "5-8",
    "9-11"
  ],
  "supported_formats": [
    "class_hour",
    "interactive_lesson"
  ],
  "educational_goals": [
    "Знакомство с культурной традицией в светском формате",
    "Развитие уважения к культурному разнообразию",
    "Расширение кругозора"
  ],
  "values": [
    "cultural_diversity",
    "family"
  ],
  "age_appropriateness_notes": {
    "1-4": "Культурно-познавательный формат: зимние традиции, сказки, ремёсла. Представлять праздник как религиозную и культурную традицию; участие в обрядах не обязательно, без религиозного принуждения.",
    "5-8": "Историко-культурный контекст и сравнение традиций разных народов по источникам. Не предполагать единой веры в классе; разделять сведения о традиции и личные убеждения.",
    "9-11": "Культурологический разговор о наследии, сравнение традиций. Рассматривать религиозную историю академически и уважительно, без миссионерского давления."
  },
  "facts_to_verify": [
    "Уточнить, что карточка описывает Рождество 7 января в традиции, использующей юлианский календарь; избегать обобщений о всех христианах",
    "Культурные обычаи описывать как традиции отдельных общин/регионов, не как универсальные",
    "Обеспечить светский, добровольный образовательный формат без религиозного принуждения"
  ],
  "regional_topics": [],
  "source_collection": "christmas",
  "source_ids": [
    "src_christmas_audit_01",
    "src_christmas_audit_02",
    "src_christmas_audit_03",
    "src_christmas_v19_01",
    "src_christmas_v19_02"
  ],
  "review": {
    "historical_accuracy_required": true,
    "age_appropriateness_required": true,
    "cultural_review_required": true
  },
  "regional_variants": [
    "RU-SVE"
  ],
  "catalog_version": "2.6",
  "updated_at": "2026-10-26"
}