{
  "id": "sverdlovsk_oblast_day",
  "title": "День образования Свердловской области",
  "aliases": [
    "День Свердловской области",
    "17 января"
  ],
  "category": "regional",
  "date_rule": {
    "type": "fixed",
    "value": "01-17",
    "note": "17 января; дата указана в региональном нормативном акте и региональных публикациях."
  },
  "supported_age_groups": [
    "1-4",
    "5-8",
    "9-11"
  ],
  "supported_formats": [
    "class_hour",
    "interactive_lesson",
    "school_event"
  ],
  "educational_goals": [
    "Знакомство с историей и символами региона",
    "Развитие интереса к краеведению",
    "Формирование уважения к культурному и историческому наследию Среднего Урала"
  ],
  "values": [
    "historical_memory",
    "citizenship"
  ],
  "age_appropriateness_notes": {
    "1-4": "Карта и символы региона, короткие рассказы и локальные примеры. Только проверенные сведения о регионе.",
    "5-8": "Краеведческая викторина и работа с источниками о развитии области. Не выдавать легенды за исторические факты.",
    "9-11": "Исследовательские мини-проекты о людях, местах и истории региона. Сопоставлять источники, не использовать неподтверждённые даты и цифры."
  },
  "facts_to_verify": [
    "Дата 17 января и правовое основание праздника: сверить с региональным нормативным актом",
    "История образования Свердловской области и её символы (герб, флаг): только по официальным региональным источникам",
    "Имена, даты и места из истории региона: проверять по региональным архивам и музеям",
    "Горнозаводская история Урала: не обобщать без источника, отделять факты от легенд"
  ],
  "regional_topics": [
    "RU-SVE/region_history",
    "RU-SVE/mining_heritage"
  ],
  "source_collection": "sverdlovsk_oblast_day",
  "source_ids": [
    "src_sverdlovsk_oblast_day_regional_01",
    "src_sverdlovsk_oblast_day_regional_02"
  ],
  "review": {
    "historical_accuracy_required": true,
    "age_appropriateness_required": true,
    "cultural_review_required": true
  },
  "regional_variants": [
    "RU-SVE"
  ],
  "catalog_version": "2.6",
  "updated_at": "2026-10-26"
}