{
  "id": "labour_day",
  "title": "Праздник Весны и Труда",
  "aliases": [
    "1 мая",
    "День труда",
    "Мир, труд, май"
  ],
  "category": "federal",
  "date_rule": {
    "type": "fixed",
    "value": "05-01",
    "note": "Ежегодно, 1 мая"
  },
  "supported_age_groups": [
    "1-4",
    "5-8",
    "9-11"
  ],
  "supported_formats": [
    "class_hour",
    "school_event",
    "interactive_lesson"
  ],
  "educational_goals": [
    "Воспитание уважения к труду",
    "Знакомство с историей праздника",
    "Формирование понимания ценности профессионального мастерства"
  ],
  "values": [
    "labour_creation",
    "mutual_aid"
  ],
  "age_appropriateness_notes": {
    "1-4": "Профессии в игре, рассказы и рисунки, полезное дело для класса. Говорить о полезном труде и взаимопомощи; не оценивать достоинство людей по профессии.",
    "5-8": "Разные профессии, проект полезного дела, исторический контекст праздника. Обсуждать права и безопасность труда без партийной агитации.",
    "9-11": "Профессиональный выбор, проекты для школы, разговор о мире труда. Разделять историю рабочего движения, современное трудовое право и политические интерпретации."
  },
  "facts_to_verify": [
    "Официальное название праздника и актуальное правовое основание даты 1 мая",
    "Исторический контекст праздника, если включён, подтверждать отдельно от современного официального статуса",
    "Региональные примеры труда/профессий использовать только с подтверждением и без стереотипизации"
  ],
  "regional_topics": [
    "RU-SVE/mining_heritage"
  ],
  "source_collection": "labour_day",
  "source_ids": [
    "src_labour_day_audit_01",
    "src_labour_day_audit_02",
    "src_labour_day_audit_03",
    "src_labour_day_v19_01",
    "src_labour_day_v19_02"
  ],
  "review": {
    "historical_accuracy_required": true,
    "age_appropriateness_required": true,
    "cultural_review_required": true
  },
  "regional_variants": [
    "RU-SVE"
  ],
  "catalog_version": "2.6",
  "updated_at": "2026-10-26"
}