{
  "id": "defender_day",
  "title": "День защитника Отечества",
  "aliases": [
    "23 февраля"
  ],
  "category": "federal",
  "date_rule": {
    "type": "fixed",
    "value": "02-23",
    "note": "Ежегодно, 23 февраля"
  },
  "supported_age_groups": [
    "1-4",
    "5-8",
    "9-11"
  ],
  "supported_formats": [
    "class_hour",
    "school_event",
    "interactive_lesson"
  ],
  "educational_goals": [
    "Воспитание патриотизма и гражданской ответственности",
    "Развитие уважения к защитникам Отечества",
    "Формирование понятия долга и чести - без гендерных стереотипов"
  ],
  "values": [
    "historical_memory",
    "citizenship"
  ],
  "age_appropriateness_notes": {
    "1-4": "Качества защитника через игру, рисунок и песню, короткие поздравления близким. Фокус на заботе, взаимопомощи и безопасности; не связывать мужество только с мальчиками.",
    "5-8": "Истории служения и защиты граждан по источникам, командные активности. Избегать милитаризации и стереотипов о гендерных ролях.",
    "9-11": "Дискуссия о гражданском долге и ответственности, проектные работы. Различать исторический контекст и современные оценки; избегать агитационных упрощений."
  },
  "facts_to_verify": [
    "Правовое основание даты 23 февраля и точное название праздника",
    "Исторический контекст - проверять даты, названия и причинно-следственные связи по надёжным источникам",
    "Региональные примеры службы, тыла или памятных мест - только при прямом подтверждении"
  ],
  "regional_topics": [
    "RU-SVE/ural_volunteer_tank_corps"
  ],
  "source_collection": "defender_day",
  "source_ids": [
    "src_defender_day_audit_01",
    "src_defender_day_audit_02",
    "src_defender_day_audit_03",
    "src_defender_day_v19_01",
    "src_defender_day_v19_03"
  ],
  "review": {
    "historical_accuracy_required": true,
    "age_appropriateness_required": true,
    "cultural_review_required": true
  },
  "regional_variants": [
    "RU-SVE"
  ],
  "catalog_version": "2.6",
  "updated_at": "2026-10-26"
}