{
  "id": "womens_day",
  "title": "Международный женский день",
  "aliases": [
    "8 марта"
  ],
  "category": "federal",
  "date_rule": {
    "type": "fixed",
    "value": "03-08",
    "note": "Ежегодно, 8 марта"
  },
  "supported_age_groups": [
    "1-4",
    "5-8",
    "9-11"
  ],
  "supported_formats": [
    "class_hour",
    "school_event",
    "interactive_lesson"
  ],
  "educational_goals": [
    "Воспитание уважения к женщинам",
    "Развитие культуры благодарности - без гендерных стереотипов",
    "Знакомство с вкладом женщин в историю и культуру"
  ],
  "values": [
    "family",
    "labour_creation"
  ],
  "age_appropriateness_notes": {
    "1-4": "Подарки своими руками, тёплые слова и поздравления близким. Не сводить праздник к внешности и домашним обязанностям; подчеркнуть уважение и достижения.",
    "5-8": "Истории женщин, изменивших мир, по источникам; творческие номера. Не закреплять стереотипы «женских» и «мужских» профессий; говорить о равных возможностях.",
    "9-11": "Дискуссия о роли женщин в обществе, истории и науке, о равных возможностях. Опираться на источники, без уничижительных обобщений."
  },
  "facts_to_verify": [
    "Правовое основание даты 8 марта и точное современное название",
    "Исторические утверждения о происхождении праздника подтверждать авторитетными историческими источниками",
    "Избегать гендерных стереотипов и сводить вклад женщин не только к семье/заботе"
  ],
  "regional_topics": [],
  "source_collection": "womens_day",
  "source_ids": [
    "src_womens_day_audit_01",
    "src_womens_day_audit_02",
    "src_womens_day_audit_03",
    "src_womens_day_v19_03",
    "src_womens_day_v19_historical_doc"
  ],
  "review": {
    "historical_accuracy_required": true,
    "age_appropriateness_required": true,
    "cultural_review_required": true
  },
  "regional_variants": [
    "RU-SVE"
  ],
  "catalog_version": "2.6",
  "updated_at": "2026-10-26"
}