{
  "id": "last_bell",
  "title": "Последний звонок",
  "aliases": [
    "Последний звонок"
  ],
  "category": "school",
  "date_rule": {
    "type": "floating",
    "value": "late_may",
    "note": "Конец мая, дата определяется школой"
  },
  "supported_age_groups": [
    "1-4",
    "5-8",
    "9-11"
  ],
  "supported_formats": [
    "class_hour",
    "school_event"
  ],
  "educational_goals": [
    "Подведение итогов учебного года",
    "Благодарность педагогам и школе",
    "Торжественное завершение этапа обучения"
  ],
  "values": [
    "mutual_aid",
    "labour_creation"
  ],
  "age_appropriateness_notes": {
    "1-4": "Участие в поздравлении старших: короткие выступления, подарки своими руками. Не использовать тревожные формулировки о расставании; участие в выступлениях добровольное.",
    "5-8": "Творческие номера и поздравление выпускников. Для этой группы событие может быть обычным школьным мероприятием; не имитировать выпускной экзамен.",
    "9-11": "Творческая программа выпускников, напутствия, символический звонок. Избегать публичного ранжирования выпускников и раскрытия личных результатов; уважать разные планы после школы."
  },
  "facts_to_verify": [
    "Не задавать единую федеральную дату: дата и формат определяются школой/региональными правилами",
    "Региональные регламенты и календарь конкретной школы проверять на нужный учебный год",
    "Не описывать локальные школьные обычаи как общероссийские нормы"
  ],
  "regional_topics": [],
  "source_collection": "last_bell",
  "source_ids": [
    "src_last_bell_audit_01",
    "src_last_bell_audit_02",
    "src_last_bell_audit_03",
    "src_last_bell_v19_01",
    "src_last_bell_v19_02"
  ],
  "review": {
    "historical_accuracy_required": false,
    "age_appropriateness_required": true,
    "cultural_review_required": true
  },
  "regional_variants": [
    "RU-SVE"
  ],
  "catalog_version": "2.6",
  "updated_at": "2026-10-26"
}