{
  "id": "middle_urals_peoples_day",
  "title": "День народов Среднего Урала",
  "aliases": [
    "Праздник народов Среднего Урала"
  ],
  "category": "regional",
  "date_rule": {
    "type": "variable",
    "value": "дата требует ежегодного подтверждения",
    "note": "В тексте регионального указа указан второй субботний день апреля; региональные публикации фиксируют проведение в другие даты в отдельные годы. Для календарного планирования ежегодно сверять официальный анонс региона."
  },
  "supported_age_groups": [
    "1-4",
    "5-8",
    "9-11"
  ],
  "supported_formats": [
    "class_hour",
    "interactive_lesson",
    "school_event"
  ],
  "educational_goals": [
    "Знакомство с культурным многообразием народов Среднего Урала",
    "Развитие уважительного межкультурного диалога",
    "Изучение традиций, языков, ремёсел и локальной истории"
  ],
  "values": [
    "cultural_diversity",
    "citizenship"
  ],
  "age_appropriateness_notes": {
    "1-4": "Сказки, ремёсла, игры и музыка разных народов края по проверенным материалам. Без стереотипизации и «типичного представителя» народа.",
    "5-8": "Сравнение культурных традиций по проверенным источникам, мини-исследования. Избегать обобщений о людях по происхождению.",
    "9-11": "Исследовательские мини-проекты и обсуждение культурного наследия края. Уважать различия; не приписывать традиции без источника."
  },
  "facts_to_verify": [
    "Дата проведения: ежегодно сверять официальный анонс региона, в разные годы она различалась",
    "Сведения о народах Среднего Урала, их языках и традициях: только по проверенным источникам, без обобщений",
    "Сказы П. П. Бажова и фольклор: отделять литературный вымысел от этнографических фактов",
    "Не приписывать народам или людям «типичные» черты по происхождению"
  ],
  "regional_topics": [
    "RU-SVE/peoples_of_the_region",
    "RU-SVE/bazhov_tales"
  ],
  "source_collection": "middle_urals_peoples_day",
  "source_ids": [
    "src_middle_urals_peoples_day_regional_01",
    "src_middle_urals_peoples_day_regional_02"
  ],
  "review": {
    "historical_accuracy_required": true,
    "age_appropriateness_required": true,
    "cultural_review_required": true
  },
  "regional_variants": [
    "RU-SVE"
  ],
  "catalog_version": "2.6",
  "updated_at": "2026-10-26"
}